<?xml version="1.0" encoding="UTF-8"?>
<!DOCTYPE Configure PUBLIC "-//Jetty//Configure//EN" "https://jetty.org/configure_10_0.dtd">

<!-- ==================================================================
Configure and deploy the test web application
===================================================================== -->

<Configure id="testWebapp" class="org.eclipse.jetty.ee.webapp.WebAppContext">

  <!-- - - - - - - - - - - - - - - - - - - - - - - - - - - - - - - - - -->
  <!-- Required minimal context configuration :                        -->
  <!--  + contextPath                                                  -->
  <!--  + war OR baseResource                                          -->
  <!-- - - - - - - - - - - - - - - - - - - - - - - - - - - - - - - - - -->
  <Set name="contextPath">/ee10-test</Set>
  <Set name="war"><Property name="jetty.webapps" default="." />/ee10-demo-jetty.war
  </Set>

  <!-- - - - - - - - - - - - - - - - - - - - - - - - - - - - - - - - - -->
  <!-- Optional context configuration                                  -->
  <!-- - - - - - - - - - - - - - - - - - - - - - - - - - - - - - - - - -->
  <Set name="extractWAR">true</Set>
  <Set name="copyWebDir">false</Set>
  <Set name="defaultsDescriptor"><Property name="jetty.home" default="."/>/etc/webdefault-ee10.xml</Set>
  <Set name="overrideDescriptor"><Property name="jetty.webapps" default="." />/ee10-demo-jetty.d/override-web.xml
  </Set>
  
  <Call name="insertHandler">
    <Arg>
      <New class="org.eclipse.jetty.server.handler.gzip.GzipHandler">
        <Set name="minGzipSize">2048</Set>
      </New>
    </Arg>
  </Call>
</Configure>
