<?xml version="1.0" encoding="UTF-8"?>
<!DOCTYPE Configure PUBLIC "-//Jetty//Configure//EN" "https://jetty.org/configure_10_0.dtd">

<Configure class="org.eclipse.jetty.ee11.webapp.WebAppContext">
  <Set name="contextPath">/badapp-uaf</Set>
  <Set name="war"><SystemProperty name="test.docroots"/>/badapp/</Set>
  <Set name="extraClasspath"><SystemProperty name="maven.test.classes"/></Set>
  <Set name="throwUnavailableOnStartupException">false</Set> <!-- Intentionally set to false to test behavior -->
  <Call name="setAttribute">
    <Arg>org.eclipse.jetty.containerInitializerExclusionPattern</Arg>
    <Arg>org.jboss.*</Arg>
  </Call>
</Configure>
