<?xml version="1.0" encoding="UTF-8"?>
<!DOCTYPE Configure PUBLIC "-//Jetty//Configure//EN" "https://jetty.org/configure_10_0.dtd">

<Configure id="Server" class="org.eclipse.jetty.server.Server">
  <!-- =========================================================== -->
  <!-- Configure Authentication Login Service                      -->
  <!-- Realms may be configured for the entire server here, or     -->
  <!-- they can be configured for a specific web app in a context  -->
  <!-- configuration (see $(jetty.base)/webapps/test.xml for an    -->
  <!-- example).                                                   -->
  <!-- =========================================================== -->
  <Call id="ResourceFactory" class="org.eclipse.jetty.util.resource.ResourceFactory" name="of">
    <Arg>
      <Ref refid="Server" />
    </Arg>
    <Call id="realmResource" name="newResource">
      <Arg>
        <Property name="login.realm" default="src/test/resources/realm.properties" />
      </Arg>
    </Call>
  </Call>

  <Call name="addBean">
    <Arg>
      <New class="org.eclipse.jetty.security.HashLoginService">
        <Set name="name">Test Realm</Set>
        <Set name="config">
          <Ref refid="realmResource" />
        </Set>
        <Set name="hotReload">false</Set>
      </New>
    </Arg>
  </Call>
</Configure>
