<?xml version="1.0" encoding="UTF-8"?>
<!DOCTYPE Configure PUBLIC "-//Jetty//Configure//EN" "https://jetty.org/configure_10_0.dtd">

<Configure id="wac" class="org.eclipse.jetty.ee10.maven.plugin.MavenWebAppContext">

  <Call class="org.eclipse.jetty.ee10.maven.plugin.WebAppPropertyConverter" name="fromProperties">
    <Arg>
      <Ref refid="wac" />
    </Arg>
    <Arg><Property name="jetty.base"/>/etc/maven.props</Arg>
    <Arg>
      <Ref refid="Server" />
    </Arg>
    <Arg></Arg>
  </Call>

</Configure>
