<?xml version="1.0" encoding="UTF-8"?><!DOCTYPE Configure PUBLIC "-//Jetty//Configure//EN" "http://www.eclipse.org/jetty/configure_10_0.dtd">

<Configure class="org.eclipse.jetty.client.HttpClient">
  <Arg>
    <New class="org.eclipse.jetty.client.transport.HttpClientTransportOverHTTP">
      <Arg>
        <New class="org.eclipse.jetty.io.ClientConnector">
          <Call name="setSslContextFactory">
            <Arg>
              <New class="org.eclipse.jetty.util.ssl.SslContextFactory$Client">
                <!-- websocket.org uses WEAK cipher suites -->
                <Set name="excludeCipherSuites">
                  <Array type="java.lang.String"></Array>
                </Set>
              </New>
            </Arg>
          </Call>
        </New>
      </Arg>
    </New>
  </Arg>
</Configure>
