<?xml version="1.0"?>
<!DOCTYPE Configure PUBLIC "-//Jetty//Configure//EN" "https://jetty.org/configure_10_0.dtd">

<Configure>
  <Call class="jakarta.security.auth.message.config.AuthConfigFactory" name="getFactory">
    <Call name="registerConfigProvider">

      <!-- The Jetty provided implementation of AuthConfigProvider which will wrap a ServerAuthModule. -->
      <Arg type="String">org.eclipse.jetty.ee.security.jaspi.provider.JaspiAuthConfigProvider</Arg>

      <!-- A Map of initialization properties. -->
      <Arg>
        <Map>
          <Entry>
            <!-- Provide the fully qualified classname of the ServerAuthModule to be used. -->
            <Item>ServerAuthModule</Item>
            <Item>org.eclipse.jetty.ee.security.jaspi.modules.BasicAuthenticationAuthModule</Item>
          </Entry>
          <Entry>
            <!-- Realm as utilised by Jetty Security  -->
            <Item>org.eclipse.jetty.ee.security.jaspi.modules.RealmName</Item>
            <Item>Test Realm</Item>
          </Entry>
        </Map>
      </Arg>

      <!-- Message Layer Identifier as per spec chapter 3.1  -->
      <Arg type="String">HttpServlet</Arg>

      <!-- Application Context Identifier as per spec chapter 3.2

        AppContextID ::= hostname blank context-path
        The algorithm applied here will use the
        _serverName on the configured JaspiAuthenticatorFactory (if set) and try to match it
        against the "server" part (in the "server /test" example below).
        Next it will try to match the ServletContext#getVirtualServerName to the "server" part.
        If neither are set, it will then try to match the first Subject's principal name, and finally fall back to
        the default value "server" if none are available.

        The context-path should match the context path where this applies.
      -->
      <Arg type="String">server /test</Arg>

      <!-- A friendly description of the provided auth-module. -->
      <Arg type="String">A simple provider using HTTP BASIC authentication.</Arg>
    </Call>
  </Call>
</Configure>
