<?xml version="1.0"?><!DOCTYPE Configure PUBLIC "-//Jetty//Configure//EN" "http://www.eclipse.org/jetty/configure_10_0.dtd">

<!-- ============================================================= -->
<!-- Configure the Jetty Server instance with an ID "Server"       -->
<!-- by adding an HTTP connector.                                   -->
<!-- This configuration must be used in conjunction with jetty.xml -->
<!-- ============================================================= -->
<Configure id="Server" class="org.eclipse.jetty.server.Server">

  <!-- =========================================================== -->
  <!-- Add an HTTP Connector.                                       -->
  <!-- Configure an o.e.j.server.ServerConnector with a single     -->
  <!-- HttpConnectionFactory instance using the common httpConfig  -->
  <!-- instance defined in jetty.xml                               -->
  <!--                                                             -->
  <!-- Consult the javadoc of o.e.j.server.ServerConnector and     -->
  <!-- o.e.j.server.HttpConnectionFactory for all configuration    -->
  <!-- that may be set here.                                       -->
  <!-- =========================================================== -->
  <Call name="addConnector">
    <Arg>
      <New class="org.eclipse.jetty.server.ServerConnector">
        <Arg name="server"><Ref refid="Server" /></Arg>
        <Arg name="factories">
          <Array type="org.eclipse.jetty.server.ConnectionFactory">
            <Item>
              <New class="org.eclipse.jetty.server.HttpConnectionFactory">
                <Arg name="config"><Ref refid="httpConfig" /></Arg>
              </New>
            </Item>
          </Array>
        </Arg>
        <Call name="addEventListener">
          <Arg>
            <New class="org.eclipse.jetty.osgi.util.ServerConnectorListener">
              <Set name="sysPropertyName">boot.resources.port</Set>
            </New>
          </Arg>
        </Call>
        <Set name="host"><Property name="jetty.http.host" /></Set>
        <Set name="port"><Property name="jetty.http.port" default="80" /></Set>
        <Set name="idleTimeout"><Property name="jetty.http.idleTimeout" default="30000"/></Set>
      </New>
    </Arg>
  </Call>

</Configure>
